,title,flair,content,date,score,comment
487,Made a bet on regional banks rebound,Gain,"It won’t let me post the gains in a certain smaller cap bank so I had to crop those out.  

While I didn’t catch the bottom no one ever does. 

I’m holding for 30s on Zion and WAL",2023-05-05 16:02:16,279,Remember [e.Digital](https://e.Digital) (EDIG) ?
488,US Recession?,Meme,,2023-04-26 03:49:39,283,"Y'all wanna see how fucking stupid shit is going to get?   
ok!"
489,JPMorgan says S&P 500 could hit 3500 'by early summer' By Investing.com,News,,2023-04-27 12:17:24,278,They will be right.
490,Succession really attacking guys.,Meme,,2023-05-08 20:22:57,275,Great job zuckerfuck
491,"I'm used to the market being regarded, but what the hell is this??",Discussion,"After the Government Money Goldrush of our glorious Pandemic years, when shares were rising faster than the virus could kill people we have as of late been experiencing a little bit of a 'lull' in the overvaluation of the stock market. Now, I think we have all basically gotten used to the idea of options being ran by Citadel, shares only going up, and Apple faking their own earnings increases by buying back shares to virtually inflate a falling EPS. This is all normal in 2023. 

But even I thought that: 7 TRILLION in uninsured deposits, a string of bank failures overshadowing the deepest part of the 2008 crisis, falling real estate, skyrocketing inflation, War in Ukraine, draught in California, negative population growth fears, slowing manufacturing, Chinese financial crisis, Political uncertainty, School shootings being more popular than the new Avatar, and Politicians threatening to hate the state murder women who have abortions, and the rise of the machines MIGHT be reason to think we are actually not 'done' with the recession. 

So, if someone would like to sit me down and explain.. 'waves hands around at the stock market' THIS! to me. I'm all motherfucking ears! (Until my ears are sold on the darkweb by agents of Fidelity because I forgot to read the fine print of my margin loan contract). 

Cause I sure as fuck don't understand what's happening. 

So until then; I'll be behind the dumpster calculating inflation adjusted prices for handy-J's with dirty Mike and the boys.",2023-05-05 14:31:56,283,Hyperinflation isn't here until it is 😉
492,I did it. I’m sorry little one.,Meme,,2023-05-02 18:08:19,277,"Switch to a cash account

Options settle by the next day"
493,"For the first time since 2021, I’m green on my account.",Gain,,2023-05-05 18:33:28,274,"Congratulations, you are now part of the 1% 💪🏼"
494,Is there an index that tracks the investments made by members of Congress?,Discussion,"Basically the title. Honest question; if members of Congress can cheat and make stock moves based on inside knowledge, is there a way for the rest of us to profit from that? Can AI be used to maximize the efficiency of this process?",2023-04-16 21:21:39,281,Check out capitoltrades.com
495,120k to 150k,Gain,,2023-05-13 00:38:03,296,"Pretty insane, your account is way too small to be gambling that many contracts"
496,What do you guys think about Wendy’s upgrading to AI with $GOOG for a better Drive through?,Meme,,2023-05-11 13:25:53,278,"Man I'm confused on this one. On one hand puts are the obvious choice because of Cramer but then you see the regards of wsb in support due to ai. 

Who do I inverse here?"
497,Commercial Real Estate (CRE) Bubble Ready to Burst: Is Another Financial Crisis Imminent? | Geopolitics and Finance,News,The commencement of the credit crisis in many Banks was just the tip of the iceberg. Financial institutions are currently grappling with a more significant credit crisis that is still unfolding and might continue for years to come.,2023-04-16 01:12:55,276,"This is a story of the have and have-nots. Office represents about 15% of the total market value in commercial real estate, so we can't forget that there are other parts of CRE that are doing perfectly fine.  Class A  office real estate will be fine. Class B and Class C will struggle. The smaller PE funds and/or banks who bought some of these CMBS or outright loaned to some of these funds with mostly Class B/Class C will struggle. These redemption gates on REITs are doing their job and preventing people from all pulling out at once and crashing CRE prices further. Average vacancy rates pre-pandemic in office were around 12%, now its closer to 15%. This was an unfolding crisis prior to 2020.

I don't know if this is a GFC moment, simply because we are all talking about it. It's not a Black Swan if you see it coming and can potentially soften the blow in time.  There will be pain, but bet that this will wipe out the zombie funds that would've blown up years from now anyway, and the systemically important companies (Blackstone, CBRE, etc). will survive because of their size and ability to throw their weight around and make deals. Don't bet against America because you will lose every time."
498,Never bet against the big banks,Meme,,2023-05-01 20:02:02,276,How much did they pay for it? I am willing to bet they paid $1. HSBC bought SVB earlier this year for 1 pound.
499,4 week t-bill 5.84%,Discussion,"Well this could get interesting for the market. As the politicians get closer to the debt debate debt is getting interesting. 

What do y’all think the market will do with rates on bills being higher then the federal funds rate.",2023-05-08 00:37:19,275,"They should get this sorted out, if they default - US credit rating will be downgraded again and will have to pay more in interest.

We might be in the point of no return where it's impossible to pay down (what's being paid is just going off to pay the interest)."
500,"Don’t worry, we are on the way to 4,750!!",Meme,,2023-05-02 17:16:33,269,Dudes looks like his all in BBBY calls went up 0.01%
501,Why cash is king for now,Discussion,"ANYTHING THAT CAN’T GO ON FOREVER WILL END. - Herb Stein

TL;DR – We are facing an economic collapse on multiple fronts. Safe-haven assets such as cash and precious metals will shine as the best option moving into the coming economic storm. A lot of people will learn the hard way that stocks DON’T always go up.

We are facing several economic headwinds such as the debt ceiling debacle, a transition to “green” alternatives, threats of de-dollarization, the world of crypto and its role in the future, sky high house prices and the beginnings of a banking crisis as consumers buckle under high interest rates. So how does one navigate all these issues? Where should you put your money? Not in stocks… yet. As the pendulum swings left to right and right to left so the marker moves in cycles. History always repeats itself just in different forms following different timelines. This is because human nature does not change.

**Bubbles**

The aggregate US market value right now is roughly $43.89T versus the annualized GDP is roughly 26.58T. The US market value is an absolutely staggering figure at 165% higher than annualized GDP. This model is often referred to as the Buffett indicator. The value of the market is over one half larger than the economy. This is considerably higher than the market has ever stood (sustainably) in modern history—higher, even, than the peak of the Great Bubble of 1929. The stock market is forward looking yes but the economy will have to increase by over 60% for stocks to be valued fairly or the value of the market would have to fall by 40% before this indicator shows a FAIRLY priced market. How likely is this increase in the near(ish) future? I put odds at 0%.

The recent market rally looks great for many, however the classic dead cat bounce serves as a word of caution to those who know what next chapter of this story holds.

It reminds me a little of that story of the oil prospector who died and went to heaven. And St. Peter said, ‘Well, I checked you out, and you meet all of the qualifications. But there’s one problem.’ He said, ‘We have some tough zoning laws up here, and we keep all of the oil prospectors over in that pen. And as you can see, it is absolutely chock-full. There is no room for you.“ And the prospector said, ‘Do you mind if I just say four words?’ “St. Peter said, ‘No harm in that. “So the prospector cupped his hands and yells out, ‘Oil discovered in hell! “And of course, the lock comes off the cage and all of the oil prospectors start heading right straight down. “St. Peter said, ‘That’s a pretty slick trick. So,’ he says, ‘go on in, make yourself at home. All the room in the world. “The prospector paused for a minute, then said, ‘No, I think I’ll go along with the rest of the boys. There might be some truth to that rumor after all. “Well, that’s the way people feel with stocks. It’s very easy to believe that there’s some truth to that rumor after all.”

**The tech bubble.** Valuations for tech companies soared as investors piled into “the next big thing” As of mid-2001, Since the market’s peak in March 2000 over four trillion dollars of stock-market value had evaporated. At least 112,000 dotcom employees had been fired. Amazon was trading at $17 down from its all time high of $113. The tech bubble had popped and value investors were sorting through the wreckage looking for companies with value that could survive. Over the two decades since billions were made on the back of this collapse, but the collapse had to happen first.

**Auto Bubble** “In the early 1900s there were two-thousand auto companies in the United state. The most important invention, probably, of the first half of the twentieth century. It had an enormous impact on people’s lives. If you had seen at the time of the first cars how this country would develop in connection with autos, you would have said, ‘This is the place I must be.’ But of the two thousand companies, as of a few years ago, only three car companies survived. And, at one time or another, all three were selling for less than book value, which is the amount of money that had been put into the companies and left there. So autos had an enormous impact on America, but in the opposite direction on investors.” – Warren Buffet

While things like cryptocurrency, AI and Evs seems to be the hallmarks for future business investment I would approach with caution. Mass speculation over each industry has fueled sky high valuations of these sectors and, while one may argue crypto has already corrected, these industries are still being defined and a washout of the “weaker” players is still imminent.

**Crypto.** People love bitcoin and other coins because of their utilities but these assets have high price fluctuations and while some people love the risk, few have seen a realized reward. people keep piling money in because crypto is the future right? The fact of the matter is a lot of people are risk averse, they want something stable. As countries create their own digital currencies (Texas is advancing a Gold backed digital currency bill) these options are most likely to be adopted by the general public. I am sure a few apes, drug dealers and others will still use BTC or whatever other crypto rises from the ashes but its utility will most likely be limited to some degree. A digital greenback is likely.

**EVs**. While Tesla is most likely not going anywhere the EV race will see some losers. Legacy automakers are pilling millions upon millions into developing their own EV tech. The are only so many people buying cars and only so much market share to go around. When you buy companies that trade at astronomical P/Es you are expecting and investing in their future growth. Be aware of the pitfalls of greed and realistic in regards to what companies can actually achieve. The other issue faced by the idea of EVs is infrastructure. City grids have not been built to accommodate every house having an EV let alone two, the wires literally aren’t big enough for the ampacity draw. On the municipalities side bigger wires means bigger conduits meaning any underground wiring needs to be dug up and reinstalled. On the consumer side you are responsible for the wire from the property into your house. Some estimate the cost to redo the wiring to your house in order to accommodate an EV is roughly $7,500 and that is just for one EV, not two and it is a cost that you will have to pay. It should also be noted that property taxes will also increase as bigger power lines are installed to distribute power throughout ageing municipalities.

**A “Greener” Future where you have less green in your account.**

**Net Zero.** As countries strive towards reducing their carbon footprint government worldwide are looking for ways to innovate and revolutionize the way we use and consume energy and create pollution. Net zero homes are not a brand new concept but they are becoming built more frequently and along with countries setting standards on minimum ev production rates building standards requiring houses to be net zero are also getting a foothold. A typical net-zero home costs between 10%-30% more than an average, conventional build. Do you own a house? Are you able to afford a house? If you have to pay 10-30% more for your home could you have done it? Or would you have had to sacrifice size or other amenities because of your budget? This move towards net zero building standards is not optional and not a matter of if but a matter of when. This increase in will further fuel a crunch on the average Joe struggling to maintain their quality of life.

**Real Estate.** With rates hitting their highs average Joe is feel pressure but not pain, yet. Unemployment is relatively stable and people can still get jobs, however mass layoffs have been affecting companies and as the claws of the interest rate hikes dig in deeper the layoffs will be more pronounced and people will struggle to pay their mortgages along with high grocery prices. This is because true pain is a lagging indicator, people are struggling to stay afloat but it is manageable for now but how long this sustainable for until something breaks? Are you able to pay your mortgage or rent and groceries and still some money left over to save? Or yolo into something like BBBY?

Within the commercial real estate sector in the USA 1.5 Trillion in loans will be maturing over the next two years. Developers and landlords are calling for more time to restructure and repay debt. All while, the value of their buildings is deceasing. Consider that the bulk of commercial real estate loans were financed when base rates were near zero — far below today’s rates closer to 5%. Not only are the rates higher, but the real estate values are much lower, especially in cities afflicted with high vacancy rates from ongoing work-from-home policies. Prior to the pandemic, 95% of U.S. offices were occupied. Today, that number is closer to 47%. The drop wiped out $453 billion of commercial real-estate value, according to the U.S. National Bureau of Economic Research (NBER). More than 70% of municipal taxes come from property taxes. Without a healthy market, developers will be forced to seek tax-abatement, resulting in lower collections for city budgets, and less resources for public schools, law enforcement, public transportation and other municipal services. A sustained lack of activity in U.S. cities will further diminish the vibrancy of businesses that rely on foot traffic from offices and residents — ranging from restaurants, retail stores and more.

House prices are also expected to decline 15% in the back half of 2023. Imagine putting 5% down on a house that is now worth 15% less than what you paid.

**What to do.** “Now, Aesop was not much of a finance major, because he said something like, ‘A bird in the hand is worth two in the bush.’ But he doesn’t say when.” Interest rates—the cost of borrowing—Buffett explained, are the price of “when.” They are to finance as gravity is to physics. As interest rates vary, the value of all financial assets—houses, stocks, bonds—changes, as if the price of birds had fluctuated. “And that’s why sometimes a bird in the hand is better than two birds in the bush and sometimes two in the bush are better than one in the hand. ”In his flat, breathy twang, the words coming so fast that they sometimes ran over one another, Buffett related Aesop to the great bull market of the 1990s, which he described as baloney. Profits had grown much less than in that previous period, but birds in the bush were expensive because interest rates were low. Fewer people wanted cash—the bird in the hand—at such low rates. So investors were paying unheard-of prices for those birds in the bush. Casually, Buffett referred to this as the “greed factor.” -The Snowball -Alice Shroeder/Warren Buffet.

The Fed has been aggressively hiking rates into an inverted yield curve, this is not good, in fact this is the most inverted yield curve since 1981. A recession is coming. The only question now is will the recession be mild or severe. A lot of that will depend on the duration and the extent in the contraction in credit that lies around the bend. The Fed implicitly is calling for a recession. A soft landing that follows the Fed tightening cycle has happened 20% of the time. But at those times the Fed was not tightening into an inverted yield curve. The futures market is pricing in two rate cuts in the second half of the year. I think the Fed will be cutting rates a lot more. Everything moves in cycles. We know that in recessions, whether severe or mild, the Fed historically cuts the funds rate by 500 basis points. They’re not going to signal that right now, with unemployment at 3.5% and inflation at 6%, but that is the historical record.

At a minimum, they’re going to have to take the funds rate down to 2.5%. They’re going to have to cut rates a lot, because the one thing that hasn’t changed in this cycle is the Fed’s own view of where the neutral fed funds rate is, and that is 2.5%. Getting to 2.5% is only eliminating the excess tightening that they’ve put into the system in the past year. A lot of people don’t realize the extent of the tightening in monetary policy. The current funds rate is double the Fed’s own estimate of neutral. Which is why the yield curve is inverted as it’s been, and the money supply is contracting at an unprecedented 2.5% annual rate.

Right now interest rates are high, as of now, any cash that would be eaten away by inflation already has been. Holding cash and collecting interest is a wise choice as we wait for value to be found in the market. As we move into a recession (however deep it may be) Gold and other precious metals are also a good choice.

**When**. While it is impossible to accurately time the market it is not impossible to predict what will occur. Market cycles are just that, they are cyclical cycles with a predictable pattern. While the depths of bear markets and the peaks of bulls markets cannot be accurately predicted ahead of time we can say with certainty that they will happen. The closest thing we can do to predicting when is looking into the past

fundamental bear market lows occur only after the Fed has cut interest rates significantly, re-steepened the yield curve, and with the bond market helping re-establish a more appropriate equity risk premium.

Based on historical data, the average time between the S&P 500 peak and the onset of recession is about 6 1/2 And it takes an average of 12 1/2 months for the S&P 500 to go from peak to trough, which usually happens before a recession ends. (See chart below.)

&#x200B;

https://preview.redd.it/hwb1kracynya1.png?width=466&format=png&auto=webp&v=enabled&s=70fd4f35de0d2d824c9eb8c31e44b82231630a81

Average Recession Timeline

What I am watching for is the pause which I assume will happen next month. We should rally until then and I believe we will see renewed optimism after the pause announcement as everyone starts getting bullish again in hopes for rates to come down in the third and fourth quarter of this year. If history is right though we haven’t felt full economic pain and even in a pause max pain will not be felt its only once the fed realizes it needs to starting cutting rates that we truly feel the full effects of the rate hikes that have taken place. The recession itself, is a lagging indicator. By then It will be too late to sell but a great opportunity to start buying and DCAing in all the way to the floor.

For now, I am cash, gold and shares in a brownfield junior miner, Laurion Mineral Exploration LME.V LME.FF",2023-05-08 20:01:06,271,TLDR SPY 420c
502,Sorry guys. FRC is priming for another bank run. Nobody will trust them with deposits,YOLO,,2023-04-26 14:48:33,271,I need an update
503,Banks just posted great earnings. Why shouldn't the fed continue raising interest rates and 0.5% at the next meet?,Discussion,"According to Jpow the reason for slowing down the hikes was because there was this alleged ""bank crisis"" which now does not seem to be the case. Some of the biggest banks posted breakthrough earnings today and I believe the rest will continue to do so.

Just a few weeks prior to the potential pivot in fed stance due to this alleged bank crisis, JPow had stated that they will be more aggressive with the hikes.

Inflation is still through the roof, there maybe a minor decrease in rate of increase but it is still piping hot!

Would love to have a discussion on this :)",2023-04-15 03:14:03,270,"JPOW is a cuck with ![img](emote|t5_2th52|4263), he will never slap the market"
504,Noooooooooooooooooo,Meme,,2023-04-24 23:38:17,268,"Always Inverse WSB. This place got me hooked on BBBY, now it got everybody hooked on this bank ![img](emote|t5_2th52|4267)![img](emote|t5_2th52|4267)![img](emote|t5_2th52|4267)"
505,Talk me out of buying puts on NFLX tomorrow after horrific earnings 2 quarters in a row! 20% decline in earnings for 3.7% growth,Discussion,"NFLX a ""FANG"" was the first to report of the big tech names. The SP500 has 66 tech stocks that account for 30% of the index. 10 Big Tech companies account for 20% of the SP500. This could be a really bad sign for big tech!

NFLX 4th quarter of 2022 had 1.9% sales growth year over year, 90% earnings decline

NFLX 1st quarter of 2023 had 3.7% sales growth and 20% earnings decline

For reference the SP500 as we know it since 1957 has returned a little over 8% compounded. The average SP500 stock on those years grows sales 10-20% and earnings 5-10%. The SP500 trades historically at 17-18 earnings.

NFLX is clearly priced higher, trading at 40-50x earnings, sales has stalled and earnings is declining. NFLX is on pace to make 8 dollars roughly for the year..

Are you seeing what I am seeing? Or am I missing something? Talk me out of puts please.",2023-04-18 23:40:28,270,Don't fall for the slop that leads the sheep to slaughter
506,"In March, Germans withdrew ~€18bn from their bank accounts possibly b/c banks do not pass on higher ECB rates to customers.",Chart,,2023-05-06 12:29:17,267,That chart timeline illustrates your point so well... maybe you should have started in the 80s?
507,I'm getting divorced,Loss,,2023-05-03 01:17:46,264,Holy fck ![img](emote|t5_2th52|4260) hope u guys can work it out… Lost about 5-6k on frc myself..I started selling puts on on frc ever since Iv started to dwindle from stupid high level..high premium was really enticing and it was very profitable…Had a chance to sell for a lot more profit on top of that right before their earnings call.  I was stupid enough to hold onto my 850 or so of shares until it went down to single digit.. We all make mistakes.. it will be alright. I really don’t think your wife will leave you for making one mistake..
508,It ain’t much but it’s honest work,YOLO,,2023-05-04 18:22:43,263,AMD looks like it’s headed back to 100
509,Big Win: Florida Reacreational Marijuana Campaign Collected Enough Signatures To Qualify Legalization For 2024 Ballot Per Trulieve - MSOS,News,"Florida marijuana reform advocates have collected enough raw signatures to qualify a legalization initiative for the state’s 2024 ballot, the campaign’s top financial supporter announced on Wednesday.

The cannabis company Trulieve, which is financially backing the Smart & Safe Florida campaign, announced that advocates have “gathered sufficient raw signatures for inclusion on the November 2024 ballot.”",2023-05-10 17:13:49,257,Republicans won't allow it
510,Indicted FTX founder Sam Bankman-Fried urges court to toss charges,News,,2023-05-09 06:51:57,263,"This guy has negative testosterone. Just might be the first natural trans to grow a vagina. I can see it too.

First his 1 cm long nub will fall off and shrivel away. Then, a massive throbbing vagina will grow on his head with the clit being his “third” eye. Then he will begin to speak from his vagina head which will be a even higher pitch than his voice before.

Every time he lies (especially when it comes to money) his throbbing head vjj will begin to lactate profusely. The more cash he feeds it, the larger his brain gets."
511,Wadda u want market?,Meme,,2023-05-10 17:23:12,259,"Mr Market is irrational, bipolar, and manic."
512,how the economy works,Meme,,2023-04-25 23:11:45,255,This meme gets posted every week.
513,"$AAPL Yolo, too lazy to share DD",YOLO,,2023-04-17 14:43:24,261,I can’t imagine what kind of dd would make you buy puts out of the money expiring this week…
514,Jim Cramer: An economic wave is about to hit that will be fantastic for investors,News,,2023-05-14 22:34:19,825,I’m going to start digging a hole out back.   Can one of you guys come throw dirt over me?
515,BBBY can keep you warm at night,Meme,,2023-04-28 01:38:48,254,Living rent free in WSB mind
