,title,flair,content,date,score,comment
0,"Following this legend today made my drive home better. I know you’re in here, show yourself!!",Meme,,2023-04-17 23:26:45,33247,How is this turd still afloat?
1,One does not simply become profitable…,Meme,,2023-04-15 17:19:32,33199,First 4s of that song would make a hot sample for a beat.
2,kisd on reddit🙂,Meme,,2023-04-22 23:52:51,30713,Pete Davidson's son David Davidson with your stock market news.
3,AI chatbot to replace human order-takers at Wendy's drive-thru. 13.9 million displaced.,Meme,,2023-05-10 00:37:47,27043,It’s going to be real awkward trying to focus on my work behind the dumpster with that robot voice yelling in the background.
4,"I will be suing Robinhood for $295,000 if they do not allow me to exercise my FRC puts",Discussion,"One week ago, I reached out of Robinhood to inquire if I could cash out (exercise) my puts if FRC is suspended.

[Exhibit 1](https://preview.redd.it/ga1oydmq08xa1.jpg?width=1284&format=pjpg&auto=webp&v=enabled&s=61616e1245248e7787ed1fbdceba453cf9114467)

I was assured in writing that I would be able to exercise my in the money puts into a short position in the scenario that FRC is suspended.

[Exhibit 2](https://preview.redd.it/r43fzx5q18xa1.jpg?width=1284&format=pjpg&auto=webp&v=enabled&s=43b242122002201f188a57f9097f943f0aaca97b)

I bought and held puts which are now worth $295,000 based on these written assurances from this Robinhood representative.

[Current position, if exercised would be worth $295,000](https://preview.redd.it/fvgtm99728xa1.jpg?width=1284&format=pjpg&auto=webp&v=enabled&s=8917b0c6e1f3b71d9d8651284b3b098da259dca1)

I reached out to support recently to confirm what they already told me; that I would be able to exercise my options by entering a short position. They responded saying I ""may"" be able to exercise, but as of now they do not allow short sales

[Being gaslit by a Robinhood representative ](https://preview.redd.it/rb8zmr9k28xa1.jpg?width=1284&format=pjpg&auto=webp&v=enabled&s=6efafc8562f37122d9298cd1bc09b8b363b2ad7e)

I've already consulted a lawyer. Based on these written guarantees, I am likely to win if this comes down to a lawsuit. Robinhood, which claims to represent retail investors, has yet again proven to have no regard for their customers. While I am fully willing to go the legal route, I urge my fellow WSBers to put pressure on Robinhood to do the right thing. My correct bet, could potentially expire worthless as a result of Robinhood's lying, backstabbing practices. 

We did not allow Robinhood to get away with disabling the buy button. Yet time and time again they’ve shown they have no problem mistreating their users and causing large financial losses. The only time they act is when there is a large enough public backlash. Let’s hold Robinhood accountable. This is not just for me, it’s for the thousands who made the correct bet on FRC and may have their gains held hostage by Robinhood.",2023-05-01 13:41:29,24181,"Dude. He said in Exhibit 2 that “based on the number of **contacts** you currently hold.” Not **contracts**.

How many contacts do you have?"
5,I'm socially regarded,Meme,,2023-05-08 17:46:50,21874,What does her boyfriend think though?
6,AI is my new friend,Meme,,2023-04-29 13:48:34,21598,"Actually a bit more complicated but yes, that’s the end result. 

The complicated bit is that management consultants (that usually are the ones making or breaking the careers of professional managers in medium and big companies) now have a new tool to sell. This leads the management (CEOs and those that can influence them) to want to do that kind of projects, so that management consultants can bill some more stuff that actually doesn’t bring any value to the company, and as a token of gratitude push the career of their corporate counterparts.

Source: trust me, I know"
7,"Robinhood will let my $295,000 in FRC puts expire worthless, while other brokers allow users to cash out",Discussion,"The OCC has released guidance allowing FRC put holders to cash out and exercise their puts. Multiple brokerages like IBKR and Fidelity are allowing put holders without shares to exercise into a short position if they have enough cash collateral. 

Robinhood is also allowing FRC put holders to exercise. However due to their policy against short selling, most put holders are unable to exercise and cash out. 

[Robinhood playing chicken with my life savings](https://preview.redd.it/smm8z10dcfxa1.png?width=1284&format=png&auto=webp&v=enabled&s=d712a9972de990965c848a25c83bbb854e985726)

I falsely assumed Robinhood had its users best interests at heart. In fact I was so confident, that I arrogantly claimed Robinhood would allow me to exercise. Robinhood had previously [allowed SBNY put holders to exercise](https://www.forbes.com/sites/brandonkochkodin/2023/03/16/robinhood-bends-to-pressure-and-permits-short-selling-to-replace-put-options-on-signature-bank/?sh=4e14256b2312). I foolishly used this amongst other misinformation to misconstrue that Robinhood cared about its customers. I am deeply sorry to everyone I lashed out on defending such a corrupt, vile, dishonorable company.  

Yes I have a huge stake in making this post: [my life savings](https://preview.redd.it/kc5krwnoefxa1.jpg?width=1284&format=pjpg&auto=webp&v=enabled&s=9885568c0629bfe6dca04f397d3754361b1ccfc6)

I greedily ignored the advice of WSB and held my winning position until FRC was halted. I was overwhelmingly warned not to count on Robinhood to do right by its customers. I am extremely regretful for not listening. I know I'm not the right person to be championing this. I acted like a cocky asshole to everyone because I was so sure of myself. I was wrong and I am sorry. 

However, this is bigger than my dumb degenerate gambling ass. This is an injustice. Robinhood has every ability to cash out FRC put holders. Yet they will allow people who correctly bet against First Republic to lose everything. Thousands of dollars in Robinhood customer’s FRC puts will expire worthless on Friday. We cannot let Robinhood get away with ripping its customers off for thousands of dollars. This billion dollar company treats it's users like worthless pond scum. FUCK ROBINHOOD. 

I urge everyone reading this to reach out to Robinhood via [Twitter](https://twitter.com/robinhoodapp?s=21&t=ZU51B0sCBCIMwSP-8sbfgQ) and other social media platforms. If Robinhood bends to the pressure and allows short selling on FRC for put holders, I will donate $10,000 of my gains to the [Autism Society of America](https://autismsociety.org). Under threat of ban, I make this donation pledge. 

Footnote: Yes, I will attempt to sue Robinhood if they do not allow me to exercise. This is my last ditch effort to exhaust all routes before taking that leap.

Update: FRC will resume trading on OTC tomorrow. I should be able to sell my puts for a large gain. However Robinhood has a policy against OTC trading too. Thus they still may not let me cash out. The battle may continue….

Update update: RH support confirmed that I “should” be able to sell my puts tomorrow. Not for certain, but looks very likely I can cash out tomorrow.",2023-05-02 14:37:08,21551,People like OP are so fucking annoying
8,👾,Meme,,2023-04-30 06:25:49,16716,These dudes are involved in all financial crimes.
9,John Oliver on Cramer,Meme,,2023-04-24 07:08:06,15989,He just gave SBF the best gift of all! Now he will make bail.
10,Highly Regarded of You,Meme,,2023-05-01 22:10:22,14853,Didn't learn from. Svb lol? A put gives you the right to sell shares at the contracted strike price. Do you have the shares?  Not robin hoods fault they can't get them lol
11,"I will be suing Wendy’s for $295,000 if they do not allow me to order breakfast",Shitpost,"Sorry I don’t have screenshots as this was over the phone and then later in person. 

I called Wendy’s around 10:15 AM and asked if they were serving breakfast. The employee specifically told me that they were.  I asked a second time and they confirmed. 

I wanted to be absolutely sure so I asked, and I remember word-for-word, I said “so if I come into your restaurant, I will be able to order and receive breakfast, is that right?”

The employee responded, and I quote, “you will be able to order breakfast if you get here before lunch starts. If you get here any later, you’ll have a hard time getting breakfast.”

Perfect!

So, I wanted to wait until I was as hungry as humanly possible, to maximize my meal, so I went in to Wendy’s at about 2 o’clock that afternoon and I was SHOCKED when they wouldn’t let me order breakfast. 

Please, everyone, if we all reach out to Wendy’s on social media and apply enough pressure, they will be forced to correct this miscarriage of justice.

(disclaimer: [satire](https://www.reddit.com/r/wallstreetbets/comments/134mtep/i_will_be_suing_robinhood_for_295000_if_they_do/?utm_source=share&utm_medium=ios_app&utm_name=ioscss&utm_content=2&utm_term=1). Wendy’s is amazing)

[TEB](https://www.reddit.com/r/the_everything_bubble/?utm_source=share&utm_medium=ios_app&utm_name=ioscss&utm_content=1&utm_term=1)",2023-05-06 15:09:29,14648,[deleted]
12,Breaking: Jerome Powell clarifies his comments made during FOMC.,Meme,,2023-05-04 02:17:59,14625,A couple or more iterations and deepfake will be undetectable
13,Puts on Nike,Meme,,2023-04-18 00:43:08,13783,I actually want one. Does it have a hole for my penis though? Thats a deal breaker... I'm not taking the whole thing off just to pee
14,So this is why Elon stepped down,Meme,,2023-05-12 02:04:40,12147,AI yai yai!
15,Well well....👾,Meme,,2023-04-27 21:32:34,10357,"Monopoly was ahead of its time, I see ![gif](emote|free_emotes_pack|grin)"
16,🥲🥲,Meme,,2023-05-07 07:12:16,10270,Calls on William
17,Breaking: Jerome Powell news conference on impotence of bears,Meme,,2023-04-17 10:52:11,9783,*blaze it*
18,Here's why $GOOGL was up today,Meme,,2023-05-10 22:14:25,9791,He could have said it more
19,May you Rest In Peace 🙏,Meme,,2023-04-23 17:27:59,9691,Gain or loss porn. Either way I’ll post it
20,it’s happening,Meme,,2023-05-10 11:31:30,9649,"This picture is accurate! I live behind the Wendy’s, I know."
21,Need a new employer to fund my gambling addiction. Any suggestion?,Meme,,2023-04-22 02:26:35,9346,A factory
22,Netflix Loses 1 Million Users in Spain Over Password Policing,News,,2023-04-27 11:29:07,9306,You mean 1 million people might now buy their own account?
23,"Cathie Wood's Tesla price target $2000, meanwhile back at Starbase...",Meme,,2023-04-24 16:15:34,9220,"Of course  internet satellites are bringing new long term subscriptions to the table.

Tesla charging network is still far ahead of the rest, as is the progress of their automated driving AI.

The broken clocks come out in force at every setback."
24,Both hilarious and saddening that this is actually the reality,Meme,,2023-05-12 17:16:15,9232,A bunch of vaporware AI companies going to the moon. This is not a bubble at all...
25,Anddd it’s halted,Meme,,2023-04-25 17:14:35,8714,Halted but superstars still buying what they perceive is a discount ![img](emote|t5_2th52|4271)
26,Let them fight,Meme,,2023-04-30 11:29:53,8205,Squeeze my short nuts u nerd ass auto mod
27,"Bud Light parent company's stock downgraded by HSBC amid branding 'crisis,' huge sales drop",News,,2023-05-11 13:30:22,7874,"Their stock hasn’t dropped that much. Look at their charts. Definitely not a buying opportunity, yet."
28,Homie just came out of jail and said “Went from trading crypto n stocks to food”!! That’s what we call a r/wallstreetbets mentality 💪🏽💪🏽,Meme,,2023-04-20 16:33:07,7440,"""I ran that place lol""
As a felon myself, I can say confidently and without a shadow of a doubt, that your homie did in fact, NOT ""run that place lol"""
29,Anyone else notice Cramer's transition to Sith Lord?,Meme,,2023-04-28 19:06:24,7380,Dude has bigger jowls than my dog
30,The stock market after Powell speech,Meme,,2023-05-03 12:55:24,7227,Sedentary lifestyles ftw
31,BULLISH.,Meme,,2023-04-22 16:11:43,6810,Ford vehicles are terrible. Cramer must need it bump a few %pts so he can sell
32,"It's time, BBBYQ",Meme,,2023-04-27 02:43:53,6752,What? I just went to toys r us the other day
33,"Hi, I am Twitter's new CEO AMA",Meme,,2023-05-11 22:01:56,6411,Congrats. Twitter is meaningless. You’re the ceo of the least interesting piece of the Internet aside from Yahoo.
34,Elon Musk says he's stepping down as Twitter CEO,News,,2023-05-11 20:02:18,6383,Well we never thought of it.
35,finally found the FRC dude who was going to paris,Meme,,2023-04-26 13:45:14,6294,Can you link me the thread to paris guy? Seems like interesting convo
36,Guys I think it’s a bubble...,Meme,,2023-05-01 08:05:58,6270,here we go…
37,‼️‼️DUMP DUMP DUMP‼️‼️,Meme,,2023-05-05 15:30:40,6208,"🙏🏻 for Monday please my bet against spy needs it

Save me, Jim"
38,"„I‘m bullish on Rome.“ - Jimius Cramer, Sept 476 AC",Meme,,2023-05-05 21:37:18,6013,Just purchased air tickets to Rome … don’t jinx us
39,M2 Supply decreased. QE has quietly stopped. This is your sign here. Bear having sex on your soon to be foreclosed house.,Meme,,2023-04-26 00:43:51,5940,🤣 bears literally fucking at the mansion what a time to be alive
40,JP Morgan now holds over $2.4 TRILLION in deposits,Meme,,2023-05-01 18:07:59,5879,Waiting for cramers opinion on jpm 😂
41,Options Trading 101 😂😅😅,Meme,,2023-04-19 06:40:48,5732,The last one actually happened to me today.
42,"Feel bad about missing a play? Be inspired by the highly regarded Nolan Bushnell, who declined an offer to buy a third of $AAPL for $50k",Meme,,2023-05-09 11:48:48,5697,"This is a personal story. When I first started my company over 20 years ago, my doctor friend offered to invest some money. I told him I could use $10,000 and I would give him 50% of the company. He said it was too rich for his blood and he turned it down. Ten years later, when I was living in a mansion and going on vacation all over the world whenever I felt like I used to love bringing that up and reminding him when we were drinking beer 😂😂😂"
43,Federal Reserve pushes interest rates above 5% for first time since 2007,News,,2023-05-03 18:04:50,5669,Def taking out my savings tomorrow. I'm not letting what happened to my parents happen to me. Fuck them.
44,Puts on RIVN,Meme,,2023-04-29 21:57:37,5596,It’s not a brick guys. It’s an electric car. Well at least I didn’t blow up. #tesla
45,I Lost over 100k to Bed Bath And Beyond,Loss,"As a higher karma is needed to post ont he $bbby subredditI wasn't able to share this and ask around if anyone's going through the same and how they are dealing with it?I've been telling myself it's time to move on as there's no use pouring water over a dead plant.But it's been just mentally draining.You know, it's like all these years of hardwork gone just because of a stock.If there's anyone going through the same? Please share how you are dealing with it..

thank you..

[Added Evidence](https://preview.redd.it/qef6rzh913wa1.jpg?width=1503&format=pjpg&auto=webp&v=enabled&s=2ba03067e9743809c5051514abd8a8be2c62033f)",2023-04-25 19:11:06,5571,Oh my.
46,Absolute Legend,Meme,,2023-05-04 20:18:11,5217,At this point the only reason I follow him is to get rid of whatever he says
47,79.99 and you’ll be be rich 4 lyfe,Meme,,2023-04-19 21:30:03,5221,"You can't post losses, when you don't lose."
48,Crash imminent,Meme,,2023-04-30 23:50:32,5133,To be fair LJIM is doing better since inception than SJIM.
49,"Netflix misses subscriber estimates, reveals password crackdown to hit U.S. in Q2",News,,2023-04-19 11:41:43,5098,"Because of the the continuing price rises I canceled last April. The password crackdown removes that flexibility... Meaning I will never bother subscribing again.

Netflix has very little to offer anymore, any good original show usually gets pulled so I stopped watching them. All left is the catalogue of movies and docs from other producers."
50,You would think people would have learned by now...,Meme,,2023-04-26 18:10:09,5040,By paying so much attention to this guy you are making his opinion matter.
51,spotted in the wild,Meme,,2023-05-13 21:26:30,5305,That's a guy who is about to find out what living without student loans to pay for housing is like.
52,WSB mentality,Meme,,2023-04-29 16:34:24,5040,Im in balls deep
53,Some regard came into my law firm.,Meme,"Some guy came to my office today to seek legal action against Robinhood. 

He had a short position in FRC, claiming it was worth $295k but he was unable to sell. He claims to be misled to believe he could exercise his puts by a Robinhood representative. Taking a look at the screenshots I realized he was probably illiterate because I saw no such claim.

Sure I took his case for a fee but this guy seems dumb as shit. Robinhood and I are about to Eiffel Tower this dude and take his wife. My good buddy is a divorce lawyer that I'll probably recommend to him.",2023-05-02 00:26:38,5003,Uh huh sure.
54,Next week on stock market,Meme,,2023-04-15 05:35:18,4936,Baby goats are cute. Nice
55,It’s not over until I say it’s over.,Meme,,2023-04-16 22:34:09,4829,I gave up trying to win big and just throw 15% of my Wendy's money (not to be confused with the more valuable monopoly money) at company stock and Roth. No lambo for me.
56,Airbnb stock crashes as co-founders lose $3 billion in one day,News,,2023-05-10 21:52:57,4825,So they don’t get the security deposit back?
57,Tesla cuts prices again by $3000,News,"US Model Y long range and Model Y performance prices have been cut by another $3000 according to the official Tesla website.

Why buy a Tesla when you can wait until it's free?

Poots on Tesla",2023-04-19 03:58:31,4810,"Everything else is going up in price... 

The best car is GOING DOWN in price"
58,Default fear is bullshit and any dip that occurs is buyable,Discussion,"The US will absolutely not default, they’ll go back and forth in Congress, bullshit everyone with the media, cause a little scare, but they won’t default. We have Russia on the ropes, draining their manpower and economic power with this little proxy war in Ukraine, we’re still seizing oil fields in Syria, and we’ve got big problems in little China aka Africa. Geopolitically speaking, there’s too much shit going on for the powers that be to even think of defaulting. What we will do is go find more oil fields to seize, dictators to overthrow, and more guns, drugs, and money to trade using the CIA and some third world ass warlords. Can’t stop, won’t stop. Toby Keith might even write a new song. 

Any dip that occurs from this absolute steaming pile of bull shit is nothing but a buying opportunity.

EDIT: the play as I see it- thinking of buying FAZ, puts on KBWB, buying TBT, and/or SPY 390P for second half of June. I’ll decide by Monday. I did well with TBT before when rates were moving higher about a year ago. 

Once the dip of the dippity dip happens, calls/long anything SPY, big tech. Probably gonna buy more MSFT, AAPL, GOOG, etc.",2023-05-13 13:38:43,4872,"I'm sure our President who can't string a sentence together, ride a bike or walk up stairs can stop us from defaulting!"
59,We made it boys!,Meme,,2023-04-21 16:19:26,4734,The day wsb hacks the markets is a new beginning for the world. Until then its just trial and error
60,I Guess We Can All Relate 🤣,Meme,,2023-05-08 23:19:10,4580,Still a fuggin nerd
61,The revolution in finance fashion is here!,Meme,,2023-05-09 14:22:37,4560,"I'm a bot, *bleep*, *bloop*. Someone has linked to this thread from another place on reddit:

- [/r/destiny] [FINANCIAGA](https://www.reddit.com/r/Destiny/comments/13deg3k/financiaga/)

&nbsp;*^(If you follow any of the above links, please respect the rules of reddit and don't vote in the other threads.) ^\([Info](/r/TotesMessenger) ^/ ^[Contact](/message/compose?to=/r/TotesMessenger))*"
62,Put on RIVN,Meme,,2023-05-06 20:38:33,4536,Which country is Nebraska
63,*Superior Look *,Meme,,2023-04-28 15:59:08,4520,"Jokes on you, I bought at 17$ and still holding 🫠"
64,I discovered options 3 years ago,Loss,Just so people don't think I offed myself I still about 400k left from my stock picks from 2014 to 2021 when I cashed. Just grateful I didn't decide to learn on mu entire portfolio. Still sad I could have got a gtr.,2023-05-13 16:34:47,4414,Buying POWER
65,Felt like this fit here.......,Meme,,2023-05-01 13:57:05,3996,"grammatically, it IS correct.."
66,I’ve got this boys,Meme,,2023-04-23 10:28:24,3993,You spelled $BBY wrong.
67,Started with $12 last Monday. Bought 2 SPY 410p for Tuesday then started blowing up.,Gain,Took the gains from SPY and shorted SBUX for earnings. Then took part of that and shorted IEP. From there shorted PYPL earnings. Then shorted ABNB. Now shorting CMG is currently my only open position.,2023-05-10 17:36:07,3922,"Start with the ultimate retirement strategy and get yourself some VOO, MGK, VUG, VONG, and SCHG. You’ll be set to ride into the sunset."
68,Who’s this Theta guy everyone’s talkin about?,Meme,,2023-04-17 19:00:49,3913,"Theta guy is me on the bottom left, that on the top right is your puts and calls"
69,Other Companies vs BBBY,Meme,,2023-04-23 18:27:15,3867,Take 2% profit 👼💸
70,Green futes = down Monday,Meme,,2023-05-07 23:11:17,3843,rickety cricket
71,The Fed Right Now!,Meme,,2023-04-30 22:27:23,3706,"Don't see anything in the mandate about banks

Inflation and unemployment, that's it

Sorry banking system"
72,How are people dumb enough to keep buying BBBY? They are delisting May 3rd!,Meme,,2023-04-26 18:53:52,3664,BBBY is the charizard of pokemon cards. Last chance to get this collectors items before it delists.
73,Fact Or Cap?,Meme,,2023-04-24 19:55:46,3605,"Are they telling me the tech analysis I did in my mind by looking at the monthly graph of uvix and then concluding ""surely it's gotta go back up now"" is not relevant??? #FACTS

https://preview.redd.it/8nc1aut8e4wa1.jpeg?width=1080&format=pjpg&auto=webp&v=enabled&s=7f1119ebc529c4a4e7d1cb6a51777ef8539f9a5f"
74,JPOW drops some bars in an emergency press conference before FOMC,Meme,,2023-05-01 11:12:42,3585,![img](emote|t5_2th52|29637)
75,Fed pause and back to the moon?,Meme,,2023-04-25 05:04:49,3562,Infinite momey is when you buy monkey jpeg and puts
76,Robinhood mistakenly told its users that AMC had filed for bankruptcy,News,,2023-05-02 19:10:59,3549,Lol using Robinhood in 2023
77,Tulips....BUY !BUY! BUY! BUY !,Meme,,2023-05-11 17:04:26,3422,Honestly how does this guy make a living
78,RIP Bags Bags Bags Yeah Hodlers,Meme,"Lessons...
- No amount of WSB YOLOs was gonna save this sinking ship.
- Biz models matter.
- This isn't a team sport.
- If you're still financially alive...Do not go gentle into that good night, Old age should burn and rave at close of day;Rage, rage against the dying of the light.",2023-04-23 15:11:27,3407,So no bankruptcy rally for BBbY??
79,How to get investors the best stock price 2023 version,Meme,,2023-05-12 02:52:00,3377,You know when Papa John’s starts talking about it with making pizzas we have gone off the cliff .
80,New flavour of the year,Meme,,2023-05-01 09:18:00,3336,some dumbasses are still talking about weedstocks
81,NVDAs CEO Jensen Huang says his company is lucky,Meme,,2023-04-18 18:18:43,3305,Horrible deepfake
82,"I will be suing Robinhood for $500,000 if they don’t let me close my SPY puts for $500,000",Meme,"I opened some SPY puts yesterday and they expire today. Yesterday I was up nearly $5,000 and I know for sure they would be up $500,000 today. 

I contacted a RH special agent specialist to make sure I can sell my puts for $500,000 today. He said it was stupid and dumb but I’m pretty sure he confirmed it. Please check the attached screenshot for proof. 

Well turned out they actually expired yesterday. But my phone was dead during market close so I didn’t get to close them and they expired “worthless”.

This is unacceptable and I am suing Robinhood for $500,000 due to the negligence of their company and their inability to provide accurate value to my incredible investments!!",2023-05-02 18:27:07,3206,"U definitely have a case based on this evidence, congratulations on your extreme future wealth sir! Lol"
83,The last thing a regional bank sees before it dies,Meme,,2023-05-05 15:31:50,3183,"What's the last thing Jimmy Diamond saw when a steam roller ran him over?

**His Asshole**"
84,Is this what you want you degenerates?,Loss,,2023-05-09 13:40:07,3157,"""THX Sound"""
85,Warren Buffet : I have to give verbal blowjobs to Washington and Beijing,Meme,,2023-05-07 22:02:23,3101,Best one yet
86,JPOW’s Message To Regional Banks At The FOMC Meeting,Meme,,2023-05-03 20:04:06,3057,No banks have gone bankrupt. Those banks never existed.
87,Follow up to $MSFT post from yesterday.,YOLO,For those that asked to see it. Here the gain porn from yesterday's YOLO. Account went from a low of 875 2 months ago to hitting 400k this morning. Love yall stay safe. Still holding MSFT calls expiring friday btw.,2023-04-26 13:36:55,3047,I would have at least sold half at open and then go jerk off for a bit.
88,State of the market right now,Meme,,2023-05-08 14:29:52,3037,Ouroboros
89,So I heard you bought puts on Meta?,Meme,,2023-04-27 02:31:51,3021,Bro why does he look more and more non human as he ages?
90,Even Succession is scared of us,Meme,,2023-05-11 10:39:14,3025,Petition to rename WSB to Forum Monkeys.
91,Trading be like…,Meme,,2023-04-20 00:22:33,2991,I made $2.50 selling pics of your great grandma while taking a shit.
92,First Republic Bank is fine !!!,Meme,,2023-05-01 21:20:07,2913,Is there a way to track what he says? I want to get rich and will do so solely by investing Cramer
